platform,subreddit,created_utc,text,clean_text,sentiment_score,sentiment_label,sentiment_confidence
reddit,truespotify,2025-10-12 17:39:57,"Why is my Spotify taking up so much storage on my phone/ how do I lessen it? Not sure what causes this, how can I use less data for Spotify?      submitted by     /u/Ilovejuicy-theboys      [link]   [comments]",why is my spotify taking up so much storage on my phone how do i lessen it not sure what causes this how can i use less data for spotify submitted by u ilovejuicy theboys link comments,-0.2411,negative,0.2411
reddit,truespotify,2025-07-23 17:41:42,Spotify terminated my account without notice Reached out to support twice but got the same canned response. Any one else?      submitted by     /u/Independent_Sale2852      [link]   [comments],spotify terminated my account without notice reached out to support twice but got the same canned response any one else submitted by u independent sale link comments,0.1783,positive,0.1783
reddit,truespotify,2025-12-05 01:28:16,"No, Spotify is not trying guessing your real age I'm tired of seeing posts like ""Spotify said my age is 67 but I'm actually 17""   NO! Spotify is trying to guess the general age of your musical taste   This means it's guessing generally how old the music you listen to is, not your real age      submitted by     /u/fueled_lollipop      [link]   [comments]",no spotify is not trying guessing your real age i m tired of seeing posts like spotify said my age is but i m actually no spotify is trying to guess the general age of your musical taste this means it s guessing generally how old the music you listen to is not your real age submitted by u fueled lollipop link comments,-0.5574,negative,0.5574
reddit,truespotify,2025-07-21 12:01:46,"I am DJ X from Spotify, AMA What’s up y’all! X here, the voice behind Spotify’s DJ. I’ll be doing an AMA today at 12pm ET/9am PST/4pm GMT, and I’m excited to take you behind the scenes of how we built this thing. From voicing the DJ to shaping the personality, working with the teams bringing the tech to life, and crafting an experience that actually  feels  human, there’s a lot that goes into it.   We can talk music, we can talk DJ, or just talk about what it’s like being the voice in your ears every day. Drop your questions below, I’ll see you soon.   --   Update:  That was so much fun! Thanks for having me, y'all! Would love to hang out here longer but I'm actually headed to the studio for some more recordings 😎 Let's do this again?   https://preview.redd.it/cpoo1wpgt7ef1.jpg?width=3024&format=pjpg&auto=webp&s=fb7e976588fe780909f795ca61f2a166def45fdb      submitted by     /u/DJXfromSpotify      [link]   [comments]",i am dj x from spotify ama what s up y all x here the voice behind spotify s dj i ll be doing an ama today at pm et am pst pm gmt and i m excited to take you behind the scenes of how we built this thing from voicing the dj to shaping the personality working with the teams bringing the tech to life and crafting an experience that actually feels human there s a lot that goes into it we can talk music we can talk dj or just talk about what it s like being the voice in your ears every day drop your questions below i ll see you soon update that was so much fun thanks for having me y all would love to hang out here longer but i m actually headed to the studio for some more recordings let s do this again submitted by u djxfromspotify link comments,0.7827,positive,0.7827
reddit,truespotify,2024-06-05 15:30:54,"I canceled my Spotify subscription of 6 years. No one cares, but this is after all a rant.    I feel like I am listening to the same music over and over and over and over and over and over and over and over and over and over.   Wanna listen to 90s? Here is LUNCH by Billie Eillish 🤩✨️   Wanna listen to soft rock? Here is LUNCH by Billie Eillish 🤩✨️   Wanna listen to rap/hip hop? Here is LUNCH by Billie Eillish 🤩✨️   Made for you killed Spotify for me. Spotify makes me hate my music because it keeps on playing it over and over again, everywhere. All my playlists are just the same songs over and over again. I have over 4000 liked songs and every playlist is the same.    +   The algorithm feels way to advertisy. I notice that when artists are about to drop albums, suddenly I get an influx of music by that artists in my shuffles or playlists because Spotify thinks I actually want to listen to my liked songs when I search for public playlists.   +   Price hike, duh. And for those who care, a price hike with a CEO who said music costs nothing to make as a way of justifying not paying artists.    I will be honest too tho. If Spotify ever fixes their poop, I would come back, but until Made For You dies or is optional, I am not coming back.    BTW, I like the LUNCH song, it's just overplayed on my Spotify playlists, that's all. I am a Billie Eilish fan lol    https://community.spotify.com/t5/Live-Ideas/Remove-the-quot-Made-For-You-quot-public-playlists-or-at-least/idi-p/6070281   I created a post, like it if you agree with me!      submitted by     /u/Nomostrax      [link]   [comments]",i canceled my spotify subscription of years no one cares but this is after all a rant i feel like i am listening to the same music over and over and over and over and over and over and over and over and over and over wanna listen to s here is lunch by billie eillish wanna listen to soft rock here is lunch by billie eillish wanna listen to rap hip hop here is lunch by billie eillish made for you killed spotify for me spotify makes me hate my music because it keeps on playing it over and over again everywhere all my playlists are just the same songs over and over again i have over liked songs and every playlist is the same the algorithm feels way to advertisy i notice that when artists are about to drop albums suddenly i get an influx of music by that artists in my shuffles or playlists because spotify thinks i actually want to listen to my liked songs when i search for public playlists price hike duh and for those who care a price hike with a ceo who said music costs nothing to make as a way of justifying not paying artists i will be honest too tho if spotify ever fixes their poop i would come back but until made for you dies or is optional i am not coming back btw i like the lunch song it s just overplayed on my spotify playlists that s all i am a billie eilish fan lol i created a post like it if you agree with me submitted by u nomostrax link comments,0.9729,positive,0.9729
reddit,truespotify,2025-08-11 12:30:25,"Excuse me Spotify, but this is not Ed Sheeran I thought this was a fun mistake which I suppose AI is at fault for.    They are not even look-alikes IMHO      submitted by     /u/SeaAd5449      [link]   [comments]",excuse me spotify but this is not ed sheeran i thought this was a fun mistake which i suppose ai is at fault for they are not even look alikes imho submitted by u seaad link comments,-0.2617,negative,0.2617
reddit,truespotify,2025-06-11 14:25:52,Spotify removed monthly listeners It’s gone on every artist. Very odd choice       submitted by     /u/brycemoy19      [link]   [comments],spotify removed monthly listeners it s gone on every artist very odd choice submitted by u brycemoy link comments,-0.3804,negative,0.3804
reddit,truespotify,2025-08-26 12:31:12,Spotify is adding DMs submitted by     /u/smileguy123      [link]   [comments],spotify is adding dms submitted by u smileguy link comments,0.0,neutral,0.0
reddit,truespotify,2025-01-14 18:49:41,Strange Email from Spotify Anybody know what this could be?      submitted by     /u/_xXBEYONDXx_      [link]   [comments],strange email from spotify anybody know what this could be submitted by u xxbeyondxx link comments,-0.2023,negative,0.2023
reddit,truespotify,2025-07-31 13:46:58,simple fix to spotify's biggest problem submitted by     /u/pjh1994      [link]   [comments],simple fix to spotify s biggest problem submitted by u pjh link comments,-0.4019,negative,0.4019
