platform,subreddit,created_utc,text,clean_text,sentiment_score,sentiment_label,sentiment_confidence
reddit,spotify,2024-12-19 00:37:24,"New Report Alleges Spotify Is Filling Playlists with Ghost Artists to Minimize Royalty Costs https://consequence.net/2024/12/spotify-perfect-fit-content-report/   According to a detailed new report from Liz Pelly for Harper’s Magazine, Spotify is supplementing playlists with “ghost artists” as a means of decreasing the amount of royalties to pay and increasing overall profit margins. Known as Perfect Fit Content, this practice allegedly primarily impacts playlists in genres like jazz, classical, ambient, and lo-fi hip-hop.   The PFC program, which was introduced to Spotify editors in 2017, is reportedly designed as a way to prioritize profitability — by partnering with a “web” of production companies, many of which are located outside the US, it appears that Spotify has successfully increased the percentage of total streams towards music that is cheaper for the platform to host. Fewer royalties are paid out to real artists, while payments go to the PFC partners. The PFC partners create music to be shared under hundreds of artist profiles, many of which are completely empty and generate inconclusive searches upon further inspection.   The report includes insights from former Spotify staff, such as a playlist editor who explained that many employees didn’t initially know where the music is coming from; the internal attitude became, “If the metrics went up, then let’s just keep replacing more and more, because if the user doesn’t notice, then it’s fine.”   Pelly, who has been digging into this story for years, even traveled to Sweden in 2023 to meet with staff at local outlet Dagens Nyheter, a publication that helped revive allegations of ghost artists. Their findings revealed that around twenty songwriters are behind the work of more than five hundred “artists,” and that thousands of their tracks on Spotify have been streamed millions of times. One of these artists features a “completely made up” bio.   But not everyone at Spotify is on board with the program. “Many of the playlist editors — whom Spotify had touted in the press as music lovers with encyclopedic knowledge — are uninterested in participating in the scheme,” the report details. “The company started to bring on editors who seemed less bothered by the PFC model.”   Some of the platform’s most popular playlists, including those titled Ambient Relaxation, Deep Focus, Cocktail Jazz, and Bossa Nova Dinner, are found to be almost entirely made up of PFC music. Additionally, many of the now-departed staff members believe the company could be moving towards AI running the program.   While Spotify has repeatedly denied allegations of creating music in-house, characterizing these claims as “categorically untrue, full stop,” their cause was not helped by CEO Daniel Ek, who oddly remarked that “creating content” costs “close to zero” earlier this year.   The report arrives in a time where Spotify is under extra scrutiny for the division between human-made and AI-generated products; many users expressed disappointment over this year’s lackluster edition of Spotify Wrapped, which leaned heavily into AI and felt largely devoid of its celebratory personality. What’s more, with Ek still taking home a massive paycheck, no artist on the platform comes anywhere close to making as much through royalties – not even the most-streamed artist of 2024, Taylor Swift.      submitted by     /u/WiretapStudios      [link]   [comments]",new report alleges spotify is filling playlists with ghost artists to minimize royalty costs according to a detailed new report from liz pelly for harper s magazine spotify is supplementing playlists with ghost artists as a means of decreasing the amount of royalties to pay and increasing overall profit margins known as perfect fit content this practice allegedly primarily impacts playlists in genres like jazz classical ambient and lo fi hip hop the pfc program which was introduced to spotify editors in is reportedly designed as a way to prioritize profitability by partnering with a web of production companies many of which are located outside the us it appears that spotify has successfully increased the percentage of total streams towards music that is cheaper for the platform to host fewer royalties are paid out to real artists while payments go to the pfc partners the pfc partners create music to be shared under hundreds of artist profiles many of which are completely empty and generate inconclusive searches upon further inspection the report includes insights from former spotify staff such as a playlist editor who explained that many employees didn t initially know where the music is coming from the internal attitude became if the metrics went up then let s just keep replacing more and more because if the user doesn t notice then it s fine pelly who has been digging into this story for years even traveled to sweden in to meet with staff at local outlet dagens nyheter a publication that helped revive allegations of ghost artists their findings revealed that around twenty songwriters are behind the work of more than five hundred artists and that thousands of their tracks on spotify have been streamed millions of times one of these artists features a completely made up bio but not everyone at spotify is on board with the program many of the playlist editors whom spotify had touted in the press as music lovers with encyclopedic knowledge are uninterested in participating in the scheme the report details the company started to bring on editors who seemed less bothered by the pfc model some of the platform s most popular playlists including those titled ambient relaxation deep focus cocktail jazz and bossa nova dinner are found to be almost entirely made up of pfc music additionally many of the now departed staff members believe the company could be moving towards ai running the program while spotify has repeatedly denied allegations of creating music in house characterizing these claims as categorically untrue full stop their cause was not helped by ceo daniel ek who oddly remarked that creating content costs close to zero earlier this year the report arrives in a time where spotify is under extra scrutiny for the division between human made and ai generated products many users expressed disappointment over this year s lackluster edition of spotify wrapped which leaned heavily into ai and felt largely devoid of its celebratory personality what s more with ek still taking home a massive paycheck no artist on the platform comes anywhere close to making as much through royalties not even the most streamed artist of taylor swift submitted by u wiretapstudios link comments,0.9199,positive,0.9199
reddit,truespotify,2025-11-09 01:42:12,"Wtf spotify With the utmost respect what he fuck is Spotify doing, at this point they just give features out randomly, I made a new account cause I shared an account with a friend and our music tastes overlapped too much so it ruined my recommendations and I randomly switched to the new account to see the feature I've been waiting for on my old account ??       submitted by     /u/dj_bluee24      [link]   [comments]",wtf spotify with the utmost respect what he fuck is spotify doing at this point they just give features out randomly i made a new account cause i shared an account with a friend and our music tastes overlapped too much so it ruined my recommendations and i randomly switched to the new account to see the feature i ve been waiting for on my old account submitted by u dj bluee link comments,-0.4549,negative,0.4549
reddit,truespotify,2026-01-11 15:59:29,Spotify really needs an AI filter already. submitted by     /u/PureRushPwneD      [link]   [comments],spotify really needs an ai filter already submitted by u purerushpwned link comments,0.0,neutral,0.0
reddit,truespotify,2024-12-04 13:25:55,"2024 Spotify Wrapped was awful No interesting stats, no genres, nothing. It felt super anti climatic tbh. Even the theme felt meh. Anyone else?       submitted by     /u/CautiousAd240      [link]   [comments]",spotify wrapped was awful no interesting stats no genres nothing it felt super anti climatic tbh even the theme felt meh anyone else submitted by u cautiousad link comments,-0.8572,negative,0.8572
reddit,truespotify,2025-09-15 13:11:47,Spotify will now let free users pick and play tracks submitted by     /u/vinhphm      [link]   [comments],spotify will now let free users pick and play tracks submitted by u vinhphm link comments,0.6908,positive,0.6908
reddit,truespotify,2025-09-12 11:57:13,"I’m John, engineering manager at Spotify. I helped develop the Lossless feature. AMA! Hey all!   I’m John, an engineering manager at Spotify, and for the past couple of years, I’ve been a part of the team working on Spotify Lossless. It’s finally rolling out in Premium, and I’m here to do an  AMA on Friday, September 12th from 10am-11am ET  to answer your questions about how it works, what exactly it is, what to expect as it rolls out, and more.   A little about me: I’ve been at Spotify for 7 years, working on the consumer UX side of things. Basically, I care HUGELY about delivering software that people will love. That’s what motivates me. Lossless has been one of the most exciting (and challenging!) projects I’ve worked on, and I’m really proud of what our team has built.   So today, ask me anything about:     How Lossless streaming works   Supported devices, data use, storage, or sound quality   The UX experience   And even some Lossless trivia!     Can’t wait to chat and geek out about audio quality with you all 🎧    - John, Spotify Engineering Manager   --   Update:  Sorry all, tried to stay on a little longer but have to run now! Can I leave you with a true story that there was a moment in this project where we had a typo and launched ""ossless"" to all our team. So for a few hours, everyone internally was streaming in full ""ossless"" 🤣 Still sounded great though... In all seriousness, thank you all so much for all the questions. It was great to celebrate the launch of Lossless with you all 💚   https://preview.redd.it/cdul1sle1qof1.jpg?width=3024&format=pjpg&auto=webp&s=70aaeb8ace2e815137b6a11ed64cd3d30dad09f9      submitted by     /u/ThisIsSpotify      [link]   [comments]",i m john engineering manager at spotify i helped develop the lossless feature ama hey all i m john an engineering manager at spotify and for the past couple of years i ve been a part of the team working on spotify lossless it s finally rolling out in premium and i m here to do an ama on friday september th from am am et to answer your questions about how it works what exactly it is what to expect as it rolls out and more a little about me i ve been at spotify for years working on the consumer ux side of things basically i care hugely about delivering software that people will love that s what motivates me lossless has been one of the most exciting and challenging projects i ve worked on and i m really proud of what our team has built so today ask me anything about how lossless streaming works supported devices data use storage or sound quality the ux experience and even some lossless trivia can t wait to chat and geek out about audio quality with you all john spotify engineering manager update sorry all tried to stay on a little longer but have to run now can i leave you with a true story that there was a moment in this project where we had a typo and launched ossless to all our team so for a few hours everyone internally was streaming in full ossless still sounded great though in all seriousness thank you all so much for all the questions it was great to celebrate the launch of lossless with you all submitted by u thisisspotify link comments,0.9874,positive,0.9874
reddit,truespotify,2024-12-05 15:49:43,Why Spotify wrapped sucks this year Just saw this info on Threads and wanted to share it with you. Didn't verify this myself so feel free to do with this info whatever you want      submitted by     /u/incko      [link]   [comments],why spotify wrapped sucks this year just saw this info on threads and wanted to share it with you didn t verify this myself so feel free to do with this info whatever you want submitted by u incko link comments,0.5542,positive,0.5542
reddit,truespotify,2025-04-16 13:12:58,Spotify is down submitted by     /u/GradeyDickBotAccount      [link]   [comments],spotify is down submitted by u gradeydickbotaccount link comments,0.0,neutral,0.0
reddit,truespotify,2025-12-22 07:40:40,"Spotify’s Entire Music Library Has Been Leaked Online by A Pirate Activist Group I summarized the Anna's Archive (Hacker) blog as I can't include the url:   Blog Highlights     'Back[ing] up' close to 300TB of metadata and music files distributed in bulk torrents grouped by popularity   First fully open 'preservation archive' for music with 86 million music files representing 99.6% of listens   Recently 'discovered a way to scrape Spotify at scale'   Cutoff is 2025-07 and anything after that date may not be present   Data will be released in various stages:    Metadata already released (Dec 2025)   Music files , additional file metadata, album art, .ztdpatch files     'Downloading of individual files' could be added to Anna's Archive   Collection Overview: 15M Artists, 59M Albums, 256M Songs   Ranking the entire Spotify catalogue for your convenient mass consumption     Anna's Archive:  An open source engine for shadow libraries launched by the pseudonymous Anna. It aggregates records from other freely accessible databases, often to their own detriment ($ 5 million in damages from OCLC after scraping the Worldcat database).     Claim not to be liable for downloads of copyrighted works instead linking to 3rd party sites (Section 230)   Has faced government blocks, legal action from rightsholders (copyright), as well as mass removal of their URLs from search results -> to the tune of 749 million and counting     My Take   Preamble:   I know this will be somewhat of an unpopular opinion, running contrary to the anarchist sympathizers and music content liberation crowds. I'm only here to provide an opinion that is (a) a devil's advocate argument, (b) from an individual who is concerned about and in favor of actual legitimate preservation of art, history, culture, etc. (preservation of expired license video games, open source, public domain), and (c) a rational take considering the circumstances.   Actual Take:   This is an unprecedented breach, almost  37 times larger  that of the now second-largest archive (MusicBrainz) and even then MusicBrainz is solely concerned with metadata.   Anna's Archive has carried out brazen mass-scale DRM subversion (DMCA Section 1201) with the added caveat that they are now (a) thinking about allowing wide scale distribution of files via their own site, (b) asking for donations to carry out said sharing of (yes, it is) pirated content, and (c) now asking individuals to face consequences, subject to their ISPS, for torrenting licensed content.   Now a potential response to the above is that (a) Spotify should have implemented far more durable cybersecurity practices, (b) that this sort of outcome is reciprocal justice for Spotify's putrid payouts for artists, and that (c) the 'means justify the ends', however I find that take extremely dangerous:     Spotify is still a genuine stream of revenue for artists and by making it free, you are undermining attempts to argue for better compensation   Providing a database with the core organization metric being 'popularity' rings hollow towards the advertised sole purpose of archiving.   Devalues licensing and the use of catalogues as artist revenue generation   Attracts other malicious actors to 'hit' Spotify for user data   (Worse of them all) Provides a breeding ground for AI generation through a massive content database   (Even worse) Puts a target on genuine preservationist efforts regardless of how much they adhere to Free Use and best practices     Now Anna's Archive is distributed, lack assets, etc., so the threat of them being taken down is difficult, but still I'm quite worried about where this goes.      submitted by     /u/ShowerSufficient4165      [link]   [comments]",spotify s entire music library has been leaked online by a pirate activist group i summarized the anna s archive hacker blog as i can t include the url blog highlights back ing up close to tb of metadata and music files distributed in bulk torrents grouped by popularity first fully open preservation archive for music with million music files representing of listens recently discovered a way to scrape spotify at scale cutoff is and anything after that date may not be present data will be released in various stages metadata already released dec music files additional file metadata album art ztdpatch files downloading of individual files could be added to anna s archive collection overview m artists m albums m songs ranking the entire spotify catalogue for your convenient mass consumption anna s archive an open source engine for shadow libraries launched by the pseudonymous anna it aggregates records from other freely accessible databases often to their own detriment million in damages from oclc after scraping the worldcat database claim not to be liable for downloads of copyrighted works instead linking to rd party sites section has faced government blocks legal action from rightsholders copyright as well as mass removal of their urls from search results to the tune of million and counting my take preamble i know this will be somewhat of an unpopular opinion running contrary to the anarchist sympathizers and music content liberation crowds i m only here to provide an opinion that is a a devil s advocate argument b from an individual who is concerned about and in favor of actual legitimate preservation of art history culture etc preservation of expired license video games open source public domain and c a rational take considering the circumstances actual take this is an unprecedented breach almost times larger that of the now second largest archive musicbrainz and even then musicbrainz is solely concerned with metadata anna s archive has carried out brazen mass scale drm subversion dmca section with the added caveat that they are now a thinking about allowing wide scale distribution of files via their own site b asking for donations to carry out said sharing of yes it is pirated content and c now asking individuals to face consequences subject to their isps for torrenting licensed content now a potential response to the above is that a spotify should have implemented far more durable cybersecurity practices b that this sort of outcome is reciprocal justice for spotify s putrid payouts for artists and that c the means justify the ends however i find that take extremely dangerous spotify is still a genuine stream of revenue for artists and by making it free you are undermining attempts to argue for better compensation providing a database with the core organization metric being popularity rings hollow towards the advertised sole purpose of archiving devalues licensing and the use of catalogues as artist revenue generation attracts other malicious actors to hit spotify for user data worse of them all provides a breeding ground for ai generation through a massive content database even worse puts a target on genuine preservationist efforts regardless of how much they adhere to free use and best practices now anna s archive is distributed lack assets etc so the threat of them being taken down is difficult but still i m quite worried about where this goes submitted by u showersufficient link comments,0.1468,positive,0.1468
reddit,truespotify,2025-04-08 21:00:01,Spotify shuts down the rumor about putting ads on premium. submitted by     /u/Weak-Organization-73      [link]   [comments],spotify shuts down the rumor about putting ads on premium submitted by u weak organization link comments,-0.4404,negative,0.4404
reddit,truespotify,2025-09-01 19:44:52,"New Spotify feature is doxxing I checked Spotify today and noticed a new feature that lets you DM people. I tried it and saw a list of “suggested friends”, most I recognized, but a few I couldn’t place. Based on the music shared (it shows every single link you’ve ever sent that someone has opened, as long as they have a Spotify account), I realized some of these were people I know from Discord.   I don’t reveal my real identity on Discord, but occasionally share music in servers or while gaming. I’ve always kept Discord anonymous, and Spotify has never been a “social” app for me. But now it seems that anyone I’ve sent a Spotify link to, if they also have an account, can potentially find me, which means they could discover my full name and other account info.   It’s a little alarming. Just something to keep in mind if you share music in servers or subreddits and want to maintain your privacy      submitted by     /u/sporoni122      [link]   [comments]",new spotify feature is doxxing i checked spotify today and noticed a new feature that lets you dm people i tried it and saw a list of suggested friends most i recognized but a few i couldn t place based on the music shared it shows every single link you ve ever sent that someone has opened as long as they have a spotify account i realized some of these were people i know from discord i don t reveal my real identity on discord but occasionally share music in servers or while gaming i ve always kept discord anonymous and spotify has never been a social app for me but now it seems that anyone i ve sent a spotify link to if they also have an account can potentially find me which means they could discover my full name and other account info it s a little alarming just something to keep in mind if you share music in servers or subreddits and want to maintain your privacy submitted by u sporoni link comments,-0.3898,negative,0.3898
reddit,truespotify,2025-08-16 12:52:02,"Spotify is working on the ability to mix songs Jane Manchun Wong via Twitter:   “Spotify is working on Mixing, a mixtape-like tool for curating how the playlist transitions between musics, down to the beat, effect, waveform, etc   This is like Apple Music’s AutoMix feature but gives the power of curation to the people”   https://x.com/wongmjane/status/1956582771759137095?s=46      submitted by     /u/Raffinesse      [link]   [comments]",spotify is working on the ability to mix songs jane manchun wong via twitter spotify is working on mixing a mixtape like tool for curating how the playlist transitions between musics down to the beat effect waveform etc this is like apple music s automix feature but gives the power of curation to the people submitted by u raffinesse link comments,0.4854,positive,0.4854
reddit,truespotify,2025-01-22 17:07:48,"i’ve never “liked” a song on spotify labeling this as a question because i’m wondering if i’m the only one. spotify added the “liked songs” feature far after i’d been initially using the app, and i already log every song i like into a yearly playlist. i’m a stubborn and habitual person so i have no intention of changing this.   does anyone else not care for, or dislike the “liked songs” feature? i personally hate that it pins itself any time i acknowledge it exists, i just don’t want to use it!      submitted by     /u/MelodicWitness4618      [link]   [comments]",i ve never liked a song on spotify labeling this as a question because i m wondering if i m the only one spotify added the liked songs feature far after i d been initially using the app and i already log every song i like into a yearly playlist i m a stubborn and habitual person so i have no intention of changing this does anyone else not care for or dislike the liked songs feature i personally hate that it pins itself any time i acknowledge it exists i just don t want to use it submitted by u melodicwitness link comments,-0.946,negative,0.946
reddit,truespotify,2024-12-04 12:10:41,Spotify wrapped 2024 is finally here submitted by     /u/Ok-Comment-9070      [link]   [comments],spotify wrapped is finally here submitted by u ok comment link comments,0.296,positive,0.296
reddit,truespotify,2025-07-30 10:58:45,Spotify has also started age verification submitted by     /u/smileguy123      [link]   [comments],spotify has also started age verification submitted by u smileguy link comments,0.0,neutral,0.0
reddit,truespotify,2024-05-01 06:30:19,"spotify premium to see the lyrics? why did spotify put the lyrics behind a a premium payment??? this is really annoying since i'm mostly deaf and i rely on the lyrics to understand the songs, but i can't get a job due to the deafness so i can't pay for the premium. this has been happening all day and i can't find anyone who is talking about this, does anyone know why spotify did this, or when it'll be reverted back to before??      submitted by     /u/MeowKat090709      [link]   [comments]",spotify premium to see the lyrics why did spotify put the lyrics behind a a premium payment this is really annoying since i m mostly deaf and i rely on the lyrics to understand the songs but i can t get a job due to the deafness so i can t pay for the premium this has been happening all day and i can t find anyone who is talking about this does anyone know why spotify did this or when it ll be reverted back to before submitted by u meowkat link comments,-0.4614,negative,0.4614
