platform,subreddit,created_utc,text,clean_text,sentiment_score,sentiment_label,sentiment_confidence
reddit,spotify,2025-04-16 14:17:50,"Spotify is down rn Spotify is down for me rn, anyone else?       submitted by     /u/bigburgerboi2005      [link]   [comments]",spotify is down rn spotify is down for me rn anyone else submitted by u bigburgerboi link comments,0.0,neutral,0.0
reddit,spotify,2025-09-10 18:45:33,"Lossless is Finally Coming to Spotify! It's finally happening! Link to an article about it will be in the comments since I can't share it in the post~   Also, there wasn't really an applicable news flair (though the rules do say that posts about news/ spotify features are welcome!), so I picked the one with discussion in it; apologies if that's the wrong choice.   Eta - from this subs rules page:     Discussion about music, playlist creation, and Spotify features are encouraged.        submitted by     /u/SnatcherGirl      [link]   [comments]",lossless is finally coming to spotify it s finally happening link to an article about it will be in the comments since i can t share it in the post also there wasn t really an applicable news flair though the rules do say that posts about news spotify features are welcome so i picked the one with discussion in it apologies if that s the wrong choice eta from this subs rules page discussion about music playlist creation and spotify features are encouraged submitted by u snatchergirl link comments,0.6908,positive,0.6908
reddit,spotify,2025-12-03 12:21:55,"Spotify wrapped is out. Share your wrap here! Damn I listened way less spotify this year, I didn't played spotify as much I used to do last 2 years, mostly because I played music videos in my triple screen monitor setup and forget about it. Before I used to play it in my Alexa devices and mostly in Gym, but this year I hardly went to 2 months of gym, so.   Top 5 artists:     Shy Martin - 890 minutes, top 0.05%   The Chainsmokers   Gryffin   Hoang   Fly By Midnight     Top 5 songs (out of 2957):     Drove You Away (Fly By Midnight) - 42 times   Feelings (Shy Martin)   Good Together (Shy Martin)   Softcore (The Neighbourhood)   I WANT YOU (ehren)     Top 5 albums (out of 13):     Gravity (Gryffin)   Fictional Illustrations (New Order)   World War Joy (The Chainsmokers)   Alive (Gryffin)   All 4 Nothing (Lauv)     Top 5 genres:     Future Bass   Dance Pop   Synthpop   Alternative Pop   Tropical House     Listening Age  - 24   Total minutes  - 37,390   My 2025 Wrapped:  https://i.ibb.co/vCS2Hkjd/f1d4e8f5-6.png   My playlist:  https://open.spotify.com/playlist/37i9dQZEVXdeUB4P5K19y2?si=9ea103320e2446b3     2024: 92,961  2023: 129,297  2022: 35,957      submitted by     /u/VDownshift      [link]   [comments]",spotify wrapped is out share your wrap here damn i listened way less spotify this year i didn t played spotify as much i used to do last years mostly because i played music videos in my triple screen monitor setup and forget about it before i used to play it in my alexa devices and mostly in gym but this year i hardly went to months of gym so top artists shy martin minutes top the chainsmokers gryffin hoang fly by midnight top songs out of drove you away fly by midnight times feelings shy martin good together shy martin softcore the neighbourhood i want you ehren top albums out of gravity gryffin fictional illustrations new order world war joy the chainsmokers alive gryffin all nothing lauv top genres future bass dance pop synthpop alternative pop tropical house listening age total minutes my wrapped my playlist submitted by u vdownshift link comments,0.9478,positive,0.9478
reddit,spotify,2025-01-22 15:24:50,Spotify Donates 150000 to Trump https://pitchfork.com/news/spotify-hosts-trump-inauguration-brunch-and-makes-150000-donation-to-ceremony/      submitted by     /u/BacktotheTruther      [link]   [comments],spotify donates to trump submitted by u backtothetruther link comments,0.0,neutral,0.0
reddit,spotify,2025-05-03 12:50:04,"11 year spotify user… trying out apple music and shocked i know people have complained about spotify’s shuffle, but i never really understood why. i got apple music 3 hours ago, and the quality difference in shuffle is immediately noticeable. i’m hearing songs i haven’t heard in years. it also feels like the songs have a cohesion?? my spotify library has 7k+ songs and i used a playlist sync tool to get them on apple…. wow. and the quality of course. this might make me switch permanently… the only thing i will miss is spotify user playlists.       submitted by     /u/frangelito      [link]   [comments]",year spotify user trying out apple music and shocked i know people have complained about spotify s shuffle but i never really understood why i got apple music hours ago and the quality difference in shuffle is immediately noticeable i m hearing songs i haven t heard in years it also feels like the songs have a cohesion my spotify library has k songs and i used a playlist sync tool to get them on apple wow and the quality of course this might make me switch permanently the only thing i will miss is spotify user playlists submitted by u frangelito link comments,0.7227,positive,0.7227
reddit,spotify,2025-11-13 17:41:37,"Spotify finally updates Shuffle to include fewer repeats https://newsroom.spotify.com/2025-11-13/shuffle-update-fewer-repeats/   ""We’ve also updated our default Shuffle so you’ll get  Fewer Repeats  when you listen. This version takes your recent listening into account, so songs you heard recently are less likely to repeat soon, helping your playlists stay fresh and surprising.""      submitted by     /u/toberelated      [link]   [comments]",spotify finally updates shuffle to include fewer repeats we ve also updated our default shuffle so you ll get fewer repeats when you listen this version takes your recent listening into account so songs you heard recently are less likely to repeat soon helping your playlists stay fresh and surprising submitted by u toberelated link comments,0.6808,positive,0.6808
reddit,spotify,2023-11-19 23:53:06,"Furious about Spotify audiobooks I got 15 hours into a 16-hour audiobook and suddenly it stops playing and I get a message “You’ve used up all the included audiobook listening time in your plan this month.” Spotify, don’t advertise something to me as “Included in Premium” if you’re going to ration it. You aren’t including an audiobook if I can’t finish the damn thing without handing you $12.99 for some cockamamie “top-up” cash grab. I’ve had a Spotify Premium account for ages and I have never been as angry at them as I am right now.    Guess I’m going back to checking out audiobooks for free via the public library and Libby.      submitted by     /u/RandomNumberHere      [link]   [comments]",furious about spotify audiobooks i got hours into a hour audiobook and suddenly it stops playing and i get a message you ve used up all the included audiobook listening time in your plan this month spotify don t advertise something to me as included in premium if you re going to ration it you aren t including an audiobook if i can t finish the damn thing without handing you for some cockamamie top up cash grab i ve had a spotify premium account for ages and i have never been as angry at them as i am right now guess i m going back to checking out audiobooks for free via the public library and libby submitted by u randomnumberhere link comments,0.1536,positive,0.1536
reddit,spotify,2025-12-15 14:35:31,Spotify appears to be down Downdetector shows a ton of outages and it isn't working on my phone.   Edit: It appears to be back up.      submitted by     /u/SSJ3wiggy      [link]   [comments],spotify appears to be down downdetector shows a ton of outages and it isn t working on my phone edit it appears to be back up submitted by u ssj wiggy link comments,0.0,neutral,0.0
reddit,spotify,2025-06-12 18:22:12,Spotify not working? I'm sorry it's Spotify not working right now? Because i just paid for the premium individual plan like i have done so many times but i don't have It. They took the money tho but i didn't even recive the email saying i have bought It. If i try buying It again it's says i already have It.   Edit: After 2 hours it's working (at least for me) and i have my premium.      submitted by     /u/Vake886      [link]   [comments],spotify not working i m sorry it s spotify not working right now because i just paid for the premium individual plan like i have done so many times but i don t have it they took the money tho but i didn t even recive the email saying i have bought it if i try buying it again it s says i already have it edit after hours it s working at least for me and i have my premium submitted by u vake link comments,0.217,positive,0.217
reddit,spotify,2023-01-14 01:35:25,"No, it's not just you. Spotify is having some major issues right now. About 15 minutes ago, all of my Spotify apps (Windows, website, and Android) stopped being able to open album pages or even show them on artist pages.   Now streaming has stopped. Starting a new song plays a few seconds of it before it stops, but that might just be from cache.   https://downdetector.com/status/spotify/   Please share your similar experiences   Updates:    TIL there is an official Spotify status page:  https://status.spotify.dev/   They also have a Twitter account and they have tweeted about the issue. You can follow that if you want real-time updates pushed to you:  https://twitter.com/SpotifyStatus   The Spotify app on my Firestick seems to be working again, but not my Windows desktop app.   Android app works for me again, but it's not synced to what's playing on my Firestick   Windows desktop app is now working, but still won't sync with my Firestick   Actually it just did. Everything seems to be working for me now      submitted by     /u/paintingTape      [link]   [comments]",no it s not just you spotify is having some major issues right now about minutes ago all of my spotify apps windows website and android stopped being able to open album pages or even show them on artist pages now streaming has stopped starting a new song plays a few seconds of it before it stops but that might just be from cache please share your similar experiences updates til there is an official spotify status page they also have a twitter account and they have tweeted about the issue you can follow that if you want real time updates pushed to you the spotify app on my firestick seems to be working again but not my windows desktop app android app works for me again but it s not synced to what s playing on my firestick windows desktop app is now working but still won t sync with my firestick actually it just did everything seems to be working for me now submitted by u paintingtape link comments,0.9032,positive,0.9032
reddit,spotify,2024-12-11 00:16:34,"Have you ever blocked a musician on Spotify? If so, why? Honestly just asking out of pure curiosity. I recently blocked Kanye as he keeps (embarrassingly) appearing on my Wrapped every year, and I’m getting sick of his music popping up in every playlist Spotify generates for me.      submitted by     /u/dingdongwashboard      [link]   [comments]",have you ever blocked a musician on spotify if so why honestly just asking out of pure curiosity i recently blocked kanye as he keeps embarrassingly appearing on my wrapped every year and i m getting sick of his music popping up in every playlist spotify generates for me submitted by u dingdongwashboard link comments,-0.7115,negative,0.7115
reddit,spotify,2024-12-29 20:31:33,"Alternatives to Spotify? I've had it with Spotify's greedy corporate bullshit. I'm so sick of rampant greed destroying everything I enjoy. I've always suspected they could use their algorithms to provide a better user experience and the latest report prove that not only are they not doing that, they are using their algorithms only to squeeze every last penny they can possibly get at the expense of their customer's listening experience. I've had enough. As much as I love the convenience, I just can't support these greedy corporate bastards anymore.   Are there any other streaming services similar to Shitify besides Amazon, and Apple? I refuse to do business with any of them.   Is Pandora still a thing?       submitted by     /u/roadrunner440x6      [link]   [comments]",alternatives to spotify i ve had it with spotify s greedy corporate bullshit i m so sick of rampant greed destroying everything i enjoy i ve always suspected they could use their algorithms to provide a better user experience and the latest report prove that not only are they not doing that they are using their algorithms only to squeeze every last penny they can possibly get at the expense of their customer s listening experience i ve had enough as much as i love the convenience i just can t support these greedy corporate bastards anymore are there any other streaming services similar to shitify besides amazon and apple i refuse to do business with any of them is pandora still a thing submitted by u roadrunner x link comments,-0.907,negative,0.907
reddit,spotify,2024-05-29 16:26:32,"What’s your reason still using Spotify? Mine is that this is the only music streaming app with which I can download music to my Apple Watch, so I can listen offline without my phone (as far as I know this is the only one, please do let me know if there’s another one so I can finally switch).   Otherwise I just hate it more and more every single day. In a 24 hour playlist the same songs play 3 times in half an hour, every radio I go to the same songs keep repeating. It may be a strategy to keep users from using the app that much to save data - in which case, it works as a charm.   I see hundreds and thousands of people complain for years about very basic functionalities not working (a simple random shuffle for example), and this company is just laughing at people like me who are complaining, but keep paying. So what’s your reason for still paying?      submitted by     /u/Grgsz      [link]   [comments]",what s your reason still using spotify mine is that this is the only music streaming app with which i can download music to my apple watch so i can listen offline without my phone as far as i know this is the only one please do let me know if there s another one so i can finally switch otherwise i just hate it more and more every single day in a hour playlist the same songs play times in half an hour every radio i go to the same songs keep repeating it may be a strategy to keep users from using the app that much to save data in which case it works as a charm i see hundreds and thousands of people complain for years about very basic functionalities not working a simple random shuffle for example and this company is just laughing at people like me who are complaining but keep paying so what s your reason for still paying submitted by u grgsz link comments,0.5054,positive,0.5054
reddit,spotify,2021-12-09 23:00:18,"How Spotify Wrapped is Calculated [Explained] 2024 EDIT: Hey everyone! It's been a while since I wrote this post, and a lot has changed with Spotify wrapped since. I have recently published an updated article giving you all a deeper dive into how wrapped works, including new insights Check it out here:  Wrapped Analysis 2024   I was always curious about what range Spotify uses to calculate Wrapped and some other information so I downloaded my data over the years and compared it to my Wrapped to find out some more detailed information.   Key Takeaways     This year the data was logged from January 1st 00:00 to November 15th 23:59.   You have to listen to a song for more than 30 seconds for it to count in your song rankings.   Your top songs are calculated by play count rather than total time listened.   In your top 100 playlist only the first 10 songs are sorted by play count, the rest are close but sorted by artist.   Your total time listening includes podcasts.   Your top artists are calculated by total play counts rather than total time listening.     If you have any more questions about Spotify Wrapped feel free to ask and I will try to answer them.      submitted by     /u/Hudsonlovestech      [link]   [comments]",how spotify wrapped is calculated explained edit hey everyone it s been a while since i wrote this post and a lot has changed with spotify wrapped since i have recently published an updated article giving you all a deeper dive into how wrapped works including new insights check it out here wrapped analysis i was always curious about what range spotify uses to calculate wrapped and some other information so i downloaded my data over the years and compared it to my wrapped to find out some more detailed information key takeaways this year the data was logged from january st to november th you have to listen to a song for more than seconds for it to count in your song rankings your top songs are calculated by play count rather than total time listened in your top playlist only the first songs are sorted by play count the rest are close but sorted by artist your total time listening includes podcasts your top artists are calculated by total play counts rather than total time listening if you have any more questions about spotify wrapped feel free to ask and i will try to answer them submitted by u hudsonlovestech link comments,0.936,positive,0.936
reddit,spotify,2025-12-03 15:48:11,"Does anyone know the background music on Spotify Wrapped 2025? Hey everyone! I’m going crazy trying to find the track that plays at the end of Spotify Wrapped 2025, you know, on the page where you can choose to review specific slides. It’s a pretty chill, kind of house track with a nice bassline. It’s driving me nuts not knowing what it is! Has anyone managed to identify this song or know how to find it? Thanks in advance!    EDIT: Plan8 released the wrapped soundtrack!!! Find it here :  2025 Wrapped Soundtrack      submitted by     /u/Lanlaaan      [link]   [comments]",does anyone know the background music on spotify wrapped hey everyone i m going crazy trying to find the track that plays at the end of spotify wrapped you know on the page where you can choose to review specific slides it s a pretty chill kind of house track with a nice bassline it s driving me nuts not knowing what it is has anyone managed to identify this song or know how to find it thanks in advance edit plan released the wrapped soundtrack find it here wrapped soundtrack submitted by u lanlaaan link comments,0.7351,positive,0.7351
reddit,spotify,2024-12-27 13:03:00,What's a feature you would love to see come to Spotify? I wish we could change the tempo and pitch of songs.      submitted by     /u/LadyOfTheMorn      [link]   [comments],what s a feature you would love to see come to spotify i wish we could change the tempo and pitch of songs submitted by u ladyofthemorn link comments,0.7845,positive,0.7845
reddit,spotify,2025-07-01 18:14:34,Share your Spotify profile here! (7/1/25) Looking for Spotify profiles to follow? Share yours and look for profiles to follow here!   We encourage everyone to submit individual playlists as new posts.      submitted by     /u/whyisthissticky      [link]   [comments],share your spotify profile here looking for spotify profiles to follow share yours and look for profiles to follow here we encourage everyone to submit individual playlists as new posts submitted by u whyisthissticky link comments,0.7717,positive,0.7717
reddit,spotify,2024-09-27 15:43:07,Is Spotify down? Is anyone else's Spotify suddenly not working.      submitted by     /u/jackbowls      [link]   [comments],is spotify down is anyone else s spotify suddenly not working submitted by u jackbowls link comments,0.0,neutral,0.0
reddit,spotify,2025-06-25 10:10:36,Drop your Spotify profile and show off your playlists! Here's mine!   spoti.fi/49OnHmr      submitted by     /u/77AndyP      [link]   [comments],drop your spotify profile and show off your playlists here s mine spoti fi onhmr submitted by u andyp link comments,-0.2732,negative,0.2732
reddit,spotify,2023-11-29 17:51:59,"Is anyone else’s Spotify wrapped just totally wrong? I’m a heavy user of Spotify, I know exactly what should be in my top songs.. instead it’s just songs Iv honestly never heard of?   My stats are literally about 5% things I recognise, 95% songs and artists I have never listened to in my life.    For example my top played artist is usher.. never listened to Usher before.    It’s totally wrong has anyone else had this issue?   UPDATE:::: Iv just gone to statsforspotify.com and it all looks like how it should be. Recognise all my top artists and everything seems correct, it’s total different data to my unwrapped. FFS SPOTIFY.    Edit: I love receiving my wrapped for the year and it’s always really insightful for how my taste has changed and what kept me happy this year. Feel abit robbed that it’s all totally wrong.. I have paid quite abit for Spotify all in all so would be nice to get this sorted.. can anyone advise?      submitted by     /u/Saladassembly      [link]   [comments]",is anyone else s spotify wrapped just totally wrong i m a heavy user of spotify i know exactly what should be in my top songs instead it s just songs iv honestly never heard of my stats are literally about things i recognise songs and artists i have never listened to in my life for example my top played artist is usher never listened to usher before it s totally wrong has anyone else had this issue update iv just gone to statsforspotify com and it all looks like how it should be recognise all my top artists and everything seems correct it s total different data to my unwrapped ffs spotify edit i love receiving my wrapped for the year and it s always really insightful for how my taste has changed and what kept me happy this year feel abit robbed that it s all totally wrong i have paid quite abit for spotify all in all so would be nice to get this sorted can anyone advise submitted by u saladassembly link comments,0.8066,positive,0.8066
reddit,spotify,2025-09-03 17:43:42,"Share your Spotify profile here! (September 3, 2025) Looking for Spotify profiles to follow? Share your user or artist profile and look for profiles to follow here!   We encourage everyone to submit individual PLAYLISTS as new posts. Do not post individual tracks or playlists within this thread. Do not post user or artist profiles as a new post, please use this thread. Just a reminder, this sub is not for promotion or advertisement.   Last post here:  Share your Spotify profile here! (July 20, 2025)      submitted by     /u/whyisthissticky      [link]   [comments]",share your spotify profile here september looking for spotify profiles to follow share your user or artist profile and look for profiles to follow here we encourage everyone to submit individual playlists as new posts do not post individual tracks or playlists within this thread do not post user or artist profiles as a new post please use this thread just a reminder this sub is not for promotion or advertisement last post here share your spotify profile here july submitted by u whyisthissticky link comments,0.8807,positive,0.8807
reddit,spotify,2024-12-06 10:51:39,"For those who have 60k+ Spotify minutes this year, what was your routine? Was it the daily commute? Bedrotting with spotify? I’m curious       submitted by     /u/OverheatedGratin      [link]   [comments]",for those who have k spotify minutes this year what was your routine was it the daily commute bedrotting with spotify i m curious submitted by u overheatedgratin link comments,0.3182,positive,0.3182
reddit,spotify,2025-07-20 19:34:41,"Share your Spotify profile here! (July 20, 2025) Looking for Spotify profiles to follow? Share your user or artist profile and look for profiles to follow here!    We encourage everyone to submit individual playlists as new posts. Do not post individual tracks or playlists within this thread. Just a reminder, this sub is not for promotion or advertisement.   Last week's post here:  Share your Spotify profile here! (July 10, 2025)      submitted by     /u/whyisthissticky      [link]   [comments]",share your spotify profile here july looking for spotify profiles to follow share your user or artist profile and look for profiles to follow here we encourage everyone to submit individual playlists as new posts do not post individual tracks or playlists within this thread just a reminder this sub is not for promotion or advertisement last week s post here share your spotify profile here july submitted by u whyisthissticky link comments,0.836,positive,0.836
reddit,spotify,2025-08-18 03:49:54,"What is 1 feature Spotify needs to add? I think they need to add the Spatial Audio like Apple has, it’s so immersive and sounds amazing. What do you think they should add?      submitted by     /u/BobTheSkittle      [link]   [comments]",what is feature spotify needs to add i think they need to add the spatial audio like apple has it s so immersive and sounds amazing what do you think they should add submitted by u bobtheskittle link comments,0.743,positive,0.743
